{
  "schema_version": "1.0",
  "interface": {
    "id": "web-item-availability",
    "name": "GetWebItemAvailability",
    "description": "TEST: provide availability information to ecommerce.",
    "current_flow": "ERP -> middleware -> Sitecore",
    "target_flow": "ERP -> middleware -> Shopify",
    "source_origin": "Unknown",
    "reviewer": ""
  },
  "source": {
    "contracts": [
      "Current/Source/checkout-1.wsdl",
      "Current/Source/checkout-2.wsdl"
    ],
    "sample": "Current/Source/availability-excerpt.xml",
    "normalized_sample": "Current/Source/availability-normalized.xml",
    "fields": [
      {
        "name": "AvailableDate",
        "type": "xs:dateTime",
        "optional": true,
        "nullable": false
      },
      {
        "name": "AvailableDateRange",
        "type": "xs:string",
        "optional": true,
        "nullable": true
      },
      {
        "name": "AvailableQuantity",
        "type": "xs:int",
        "optional": true,
        "nullable": false
      },
      {
        "name": "InStock",
        "type": "xs:boolean",
        "optional": true,
        "nullable": false
      },
      {
        "name": "SKU",
        "type": "xs:string",
        "optional": true,
        "nullable": true
      },
      {
        "name": "SKUType",
        "type": "xs:string",
        "optional": true,
        "nullable": true
      },
      {
        "name": "WebProductId",
        "type": "xs:string",
        "optional": true,
        "nullable": true
      }
    ],
    "normalization_note": "The pasted excerpt lacks </result> and </WebItemAvailability>. Only these closing tags were added in the normalized copy. The excerpt is transcribed from the chat; whitespace may differ."
  },
  "target": {
    "platform": "Shopify",
    "api_version": "2026-07",
    "research_method": "official_public_documentation",
    "selected_operation": "inventorySetQuantities"
  },
  "known_rules": [
    {
      "id": "decision:SKUType",
      "attribute": "SKUType",
      "statement": "Exclude SKUType from target payload.",
      "confirmed_by": "Test analyst"
    },
    {
      "id": "decision:AvailableQuantity",
      "attribute": "AvailableQuantity",
      "statement": "Map the absolute sellable total to available inventory.",
      "confirmed_by": "Test analyst"
    }
  ],
  "answers": {
    "Q01": "Update sellable inventory.",
    "Q02": "",
    "Q03": "ERP owns absolute sellable totals.",
    "Q04": "One fulfillment location.",
    "Q05": "",
    "Q06": "",
    "Q07": "",
    "Q08": "N is normal stock; do not send this attribute.",
    "Q09": ""
  },
  "additional_context": "Add your current understanding, examples and corrections here. Unknown business rules can remain unknown.",
  "human_inputs_sha256": "ede11b2ef3c905b930cebc23a06817e280ab224a655a1662fec4e36cc40a56d1"
}
